name,description,price,image_url,category,source_url
"Dog Chow Adultos Razas Medianas y Grandes","Alimento balanceado para perros adultos de razas medianas y grandes. Con proteínas de alta calidad, vitaminas y minerales.","18999","https://puppis.vteximg.com.br/arquivos/ids/178785-1000-1000/Alimento-Perro-Dog-Chow-Adultos-Medianos-y-Grandes-21-Kg-1-5982.jpg?v=638082183459400000","perro","https://www.puppis.com.ar/alimento-para-perro-dog-chow-adultos-medianos-y-grandes-21-kg/p"
"Excellent Adulto Pollo y Arroz","Alimento premium para perros adultos. Fórmula con pollo y arroz de alta digestibilidad.","22499","https://puppis.vteximg.com.br/arquivos/ids/178786-1000-1000/Alimento-Perro-Excellent-Adulto-Pollo-y-Arroz-15-Kg-1-5983.jpg?v=638082183459400000","perro","https://www.puppis.com.ar/alimento-para-perro-excellent-adulto-pollo-y-arroz-15-kg/p"
"Pro Plan Adulto Razas Pequeñas","Alimento super premium para perros adultos de razas pequeñas. Con OptiHealth.","25999","https://puppis.vteximg.com.br/arquivos/ids/178787-1000-1000/Alimento-Perro-Pro-Plan-Adulto-Razas-Pequenas-7-5-Kg-1-5984.jpg?v=638082183459400000","perro","https://www.puppis.com.ar/alimento-para-perro-pro-plan-adulto-razas-pequenas-7-5-kg/p"
"Cat Chow Gatitos","Alimento balanceado para gatitos hasta 12 meses. Con DHA y antioxidantes.","12999","https://puppis.vteximg.com.br/arquivos/ids/178788-1000-1000/Alimento-Gato-Cat-Chow-Gatitos-8-Kg-1-5985.jpg?v=638082183459400000","gato","https://www.puppis.com.ar/alimento-para-gato-cat-chow-gatitos-8-kg/p"
"Whiskas Adultos Carne","Alimento para gatos adultos sabor carne. Con Omega 6 y zinc para piel y pelo.","10999","https://puppis.vteximg.com.br/arquivos/ids/178789-1000-1000/Alimento-Gato-Whiskas-Adultos-Carne-10-Kg-1-5986.jpg?v=638082183459400000","gato","https://www.puppis.com.ar/alimento-para-gato-whiskas-adultos-carne-10-kg/p"
